{
  "schema": "don.retail-control.lifecycle-proof.v1",
  "recorded_on": "2026-08-09",
  "evidence_source": {
    "path": "docs/tooling/live-control.md",
    "sha256": "5487b2f72c9c50175c3cae6ecbe3d5ec7c77dd7906aaf1e0621c1127e2df488f"
  },
  "supported_retail": {
    "executable_sha256": "30478a44b577cb11ebcbbbf53d3e93ba02fd2aacf3bdefa6552c9b6449625079",
    "runtime_base": "0x00D60000"
  },
  "controller": {
    "generation": "relaunch-v22",
    "dll_sha256": "e2829ae2ae93e24e95b87d2d9e469fc79e915b67e30f53d9638b84fbe6c92527",
    "load_base": "0x6AEA0000",
    "image_size": "0x165000"
  },
  "session": {
    "pid": 13876,
    "scope": "freshly paused solo skirmish"
  },
  "result": {
    "consecutive_stop_rearm_cycles": 5,
    "final_park_acknowledged": true,
    "acknowledgement_boundary": "retail-main-thread",
    "dropped_events_after_each_acknowledgement": 0,
    "external_stop_read": {
      "coverage": "after-every-stop",
      "bytes_hex": "E8 45 67 3C 00"
    },
    "scoped_wer_dump_directory_new_files": 0
  }
}
